Link,Newspaper,Photo YN,Front page YN,Date,Title,Author,Notes,Word Count,Text
http://theprince.princeton.edu/princetonperiodicals/cgi-bin/princetonperiodicals?a=d&d=Princetonian19680501-01.2.10&srpos=166&e=------196-en-20-Princetonian-161-byDA-txt-txIN-columbia----1968--,Daily Princetonian,N,Y,5/1/68,Could it happen here?,Mike Slotznick,,819,"NEW YORK _æ ""It could never happen at Princeton,"" many Columbia students say about the ""liberation"" movement here. Three weeks ago, they said it could never happen at Columbia. They were wrong once. Could they be wrong about Princeton, too? A comparative analysis of recent events at the two universities provides a number of telling differences _æ and similarities. The immediate issues behind the Columbia uprising are somewhat similar to those raised at Princeton fs the past several months. In fact, nothing could be more familiar to Princeton ears than cries of racism and collaboration with the military. IDA issue The Columbia insurrection began with an anti-IDA protest, much like that carried on by the Princeton SDS last fall. It took quite a different turn. At Princeton, 70 students staged a sit-in before the administration fully reviewed its alliance with the defense research organization. At Columbia, an entire campus has approached civil war in order to force such a review. The issues of racism are more subtle. Both schools have grappled with the problem unsuccessfully. Adjacent to black Harlem, Columbia has a history of poor community relations. The dispute over the gymnasium is but the latest manifestation of the university's alleged lack of concern for the ghetto. At Princeton, awareness of racial issues is just beginning, due to a potent and vociferous ABC. A recent manifestation of this awareness is the protest against university investments in South Africa. Deeper issues The average protester or antiprotester on the Columbia campus will cite IDA and the gym as the primary issues. There are deeper ones. Faculty and students at Columbia insist that negligence on the part of both faculty and administration has done much to incite and nourish the revolt. A weary chemistry professor, after a three-day vigil and a physical confrontation with city police, noted, ""What really is at stake is the whole problem of student power."" The dilemma of legitimacy of student protest was raised at Princeton over the IDA. Then, the university allowed outside legal action, but withheld its own discipline. At Columbia, police action was avoided until early yesterday morning. The architecture of the trustee-administration-faculty-student pyramid at Columbia is being reassessed following events this week. Like Princeton, the trustees at Columbia have been among the most difficult to convince of protesters' arguments. Less intransigent has been the administration, which now realizes the weight of ""aloofness"" charges; but it is still reluctant to change its attitude. The lack of consultation with faculty and students has been crucial in both allowing and perpetuating the crisis. One statistics professor claimed that the Columbia faculty bears as much blame as the administration. She decried the absence of community spirit among the faculty, and attributed it to the lack of community living. While Princeton faculty live, for the most part, near the campus, the Columbia faculty live throughout the New York area. The absence of ""togetherness,"" she said, breeds dissension and prevents the faculty from becoming a mediating force between students and administration. Another difference in faculty operation lies in the status of junior faculty members. Princeton, like most American universities, grants full voting privileges to all faculty members. Columbia denies non-tenured members _æ who frequently are in best contact < with students _æ the right to vote. Due to lack of space, they were not even seated in Sunday morning's ""all-faculty"" summit conference. And what of the students? Are they any different from those at Princeton? The SDS and its sympathizers number proportionately greater at Columbia. But amidst the enormous chaos, tension and anger on the Columbia campus, it is easy to forget that only 650 students of the university community's 25,000-plus were holding buildings. Princeton attitudes The great majority of students and faculty questioned said that a comparable proportion of dissenters at Princeton would be both difficult to muster and easy to overcomes They referred to general political attitudes at Princeton. A Columbia law student asserted that there is ""a built-in cynicism"" at Columbia, an eagerness to reform. Instrumental in creating the cynical and radical spirit in the surrounding metropolis. New York's diversity of viewpoints makes for an influx of new and better ideas, according to most students there. The lack of community spirit applies to students as well as to faculty. Off-campus social opportunities, great polarity between athletes and intellectuals and the large number of students are responsible for, this. Several student crusaders were quick to point out some of the striking similarities between Princeton and Columbia. Lack of moderates Both, for example, lack a signify. cant organization of Liberals who are not ""leftists."" The SDS has*"" dominated all reform movements, leaving no avenue for more moderate group identification. A professor of art history emphasized that the spirit at Columbia is not unique. Most fundamental, he claimed, is that ""this is the time of year when students used to make panty-raids."" Spring fever, he asserted, coupled with political unrest, creates a potential for disaster."
http://theprince.princeton.edu/princetonperiodicals/cgi-bin/princetonperiodicals?a=d&d=Princetonian19680501-01.2.9&srpos=165&e=------196-en-20-Princetonian-161-byDA-txt-txIN-columbia----1968--,Daily Princetonian,N,Y,5/1/68,President Kirk,Chris Connell,,468,"NEW YORK _æ ""The decision was the most painful one I have ever made. It was my judgment and that of my associates that this action be taken."" The words were those of haggard Columbia president Grayson L. Kii'k, speaking at a 6:15 a.m. press conference yesterday in the echoing rotunda of Low Memorial Library. The president, standing tall and portly in a gray three-piece business suit, appeared calm throughout the 35-minute session. On his left as he spoke was the vice-president and provost of the college, David B. Truman. Mr. Kirk read a 300-word prepared statement before accepting questions from 50 reporters. It said in part: ""If Columbia had been prepared to accede to the students' demand for amnesty from all disciplinary action resulting from their illegal conduct, we would have dealt a near-fatal blow not only to this institution but to the whole of American higher education. Columbia's action tonight thus is not merely in the interests of its own future but that of its sister institutions."" The president's second questioner asked whether he was resigning. ""I have not considered it,"" Mr. Kirk answered quietly. Mr. Truman denied that a great many faculty members would carry out their threats to leave Columbia's staff if police were called in. ""We had to work with them,"" Mr. Truman said. ""We obviously had to cooperate with them in laying out a general plan so the removal of the students would be as smooth as possible."" Early planning Mr. Kirk also affirmed that the logistics purposes, it was necessary to make plans with the police early in the evening."" He added that the plans could have been stopped at any point throughout the evening. Asked if he would be able to administer the university after the events of the night before, Mr. Kirk said, ""I believe we will."" Mr. Kirk also affirmed that the university would be pressing trespassing charges against the more than 600 arrested students. Neither Mr. Truman nor Mr. Kirk would specify the amount of academic punishment awaiting the arrested students. Mr. Kirk said that Mayor Lindsay had called him about midnight Monday for consultation on the situation. He denied that the mayor had attempted to bargain for a halt in Mr. Kirk's plans to bring in the police. Concerning charges of police brutality Mr. Truman said, ""Reports that I have show there were no serious injuries inside the building."" He praised the police for minimizing violence and carrying out the operation effectively. At 6:50 a.m. yesterday Mr. Kirk cut the conference short, saying that he and Mr. Truman had not lept all night and were tired. Newsmen were generally annoyed at his departure. Even as he left the rotunda to temporary offices on the ground level floor, students were gathering outside, chanting ""Kirk must go."""
http://theprince.princeton.edu/princetonperiodicals/cgi-bin/princetonperiodicals?a=d&d=Princetonian19680501-01.2.8&srpos=164&e=------196-en-20-Princetonian-161-byDA-txt-txIN-columbia----1968--,Daily Princetonian,N,Y,5/1/68,Police violence unites leaders: Columbia students continue boycott,"Chris Connell, Greg Conderacci",,1230,"NEW YORK_æStudent leaders united formerly opposed student factions here yesterday afternoon and agreed to continue a boycott of classes. The university announced that classes would not be held today, although the university will be open. It recommends that the faculty and students use the time to meet together for discussions. Over 3,500 Columbia students, faculty and employees signed a statement yesterday calling for the resignation of President Grayson L. Kirk, Vice-President David B. Truman, and the university trustees, who approved the order to send police on to the campus early yesterday morning. The move came in the wake of yesterday morning's arrest of 628 students in the five buildings which had been seized by the protesters early last week. The campus was under virtual police rule following the 1:30 a.m. decision by Mr. Kirk to clear the buildings. Sentiment concerning the president, who called in the police after six days of threats, was uniformly negative. Students chanted ""Kirk must go!"" throughout the day. A tighter hold was placed yesterday around the already closely guarded campus when faculty forbade access for a time to students. The only people admitted were faculty and staff members. Irate Columbia students thronged outside the main gate, demanding admittance. By yesterday afternoon, students living in dorms on the campus were being allowed in. The mood of the campus was one of subdued disbelief today. The two hours in the middle of the night during which the police struck took on a nightmarish aura. For many, it was too awful to believe. Mr. Kirk made the move at a time when many of the protesting students felt their demand for amnesty as a prerequisite for bargaining was very close to being realized. The police did not surprise the campus, however, when they moved in at 2:25 a.m. Rumors had been spreading around the campus since 12:30 that a ""bust"" was coming. Students of the anti-strike Majority Coalition who were blockading the pi .testers in Low Memorial Library moved off en masse at 1:45 a.m. They had said previously they would leave if the police came to remove the students. By 2:30, 30 police were lined up by twos where 70 students and faculty were lying six deep in an attempt to save the protesters from the police. Several hundred onlookers were gathered around to watch. Plainclothes policemen were guarding one side of the door. At about 2:35, a Spanish instructor named Fredrick Courtney became the first casualty of the night, Mr. Courtney had been with the group blocking the door. He left for an unknown reason. When he tried to return, three burly plainclothesmen tackled him and they came crashing into a group of onlookers.  When the instructor attempted to wriggle free, the police pummeled him into the ground, apparently kneed him, then dragged him over to a hedge beyond which people were being allowed to stay, and threw him over the hedge. His injuries were mainly bruises. While this was going on around Low, Hamilton Hall, the building filled entirely by blacks, was falling victim to an inside job by the Tactical Police Force. The TPF entered the building via an underground series of tunnels. The Hamilton protesters offered no resistance, and were led peacefully to paddywagons parked by the steps of the library. The first building to be seized a week ago, Hamilton was the first to be regained by the university. It was widely known that not all of the people in Hamilton were connected with Columbia. Shortly before the police raid, the Harlem community blacks left. Around 3 a.m. havoc broke loose nearly simultaneously in Low, Avery and Fayerweather halls. A police captain outside Low asked the singing barricaders to move several times. When he said, ""You don't want to be arrested. You're all college students,"" they screamed back, ""Yes we do."" With that, the captain ordered his men ahead. The police simply plowed into the screaming barricaders, pushing, shoving and hurling them out of the way. No arrests were made. Here, as in other places throughout the two hours of turmoil, the plainclothesmen were the most blatantly physical of the police. At the same time, human barricades in front of Avery and Fayerweather were forcibly dispersed. ""This man, this river of police, came storming towards us,"" claimed one Barnard girl who had been outside Fayerweather and was injured in the scuffle. By 3:05 the police were inside Low, had begun to evacuate Avery and Fayerweather, and had already regained Hamilton. Mathematics, reportedly housing the most violent extremists, was not broken into until 3:45, and it was 5:00 before the last protesters were brought out. The more squirming an arrested protester did while he was carried out, the harder was his landing outside. A police spokesman said yesterday that none of the entering policemen carried nightsticks. When he was told that St. Luke's and Knickerbocker Hospitals had treated 96 persons, he expressed surprise, claiming that police had not harmed anyone willfully. One student who was being carried out of Mathematics wrapped in a blanket' by six policemen, was apparently giving them trouble. When they slammed him to the ground to get a better grip on the blanket, he yelled, ""I'll walk out! I'll walk out!"" One of the police said back, ""Oh no you won't!"" The student's last ""I'll walk out!"" was cut short by the dull thud of the striking nightstick. The scene resembled a war zone far more than it did a college campus. Shouts and screams could be heard across the campus for the entire two hours. Columbia basketball coach Jack Rohan was standing outside Mathematics about 4 a.m. with a look of disbelief watching the students being hauled away. He had been representing the administration in a last-ditch attempt to convince the protesters to come out before the cops came in. ""It couldn't have been resolved without this action,"" he said sadly. When asked, he replied that Columbia had ""definitely"" lost basketball prospects due to the adverse publicity. Sidney* Davidoff, troubleshooter for New York's Mayor John V. Lindsay, was also standing outside of the math building. Asked when the university had requested the police to move in, he gave a straight-faced ""about seven days ago."" Most of the buildings the strikers occupied were in shambles when' seen yesterday morning. A dispute arose as to how much damage the university was responsible for, and how much the students. Most of the damage can be traced to the students, with some major exceptions. Police broke through the glass panels on every door in Mathematics, for instance, to root out the strikers. For many of the rooms, the police's entrance was the first time those rooms had been touched. The police moved forcefully and methodically as they handled the protesters outside the halls. Police herded the groups gathered around Avery and Fayerweather Halls into the plaza in front of Low Library, after they had isolated the areas around the halls. It was virtually impossible to move from one area to another about the campus. One Columbia student raised his arms in defense or resistance, and was beaten to the ground by three policemen. They shoved him down three flights of narrow stairs. Mounted police rode up and down Broadway ""like Cossacks,"" said one student who was practically trampled by a galloping cop."
http://www.thecrimson.com/article/1968/4/27/columbia-demonstration-enters-4th-day-pnew/?page=single,Harvard Crimson,N/A,N/A,4/27/68,Columbia Demonstration Enters 4th Day,James K. Glassman,,1124,"NEW YORK, April 26--An estimated 300 Columbia University students, entrenched for the fourth day in five classroom and administration buildings, won support today from the neighboring Harlem community and from black militants H. Rap Brown and Stokely Carmichael. Brown, his face drawn and nearly milky pale, and Carmichael, in a blue pin-striped suit, led a crowd of 200 junior high and high school youths on a charge from Amsterdam Avenue, through police lines, and onto the besieged campus. Police immediately sent for reinforcements and sealed off the campus, allowing only Barnard and Columbia students to enter through the outside gates. Other police guarded entrances 10 classroom buildings. Over 100 policemen were stationed around the area, and in nearby Harlem extra patrols roamed the streets. On to Hamilton Hall The group marched to Hamilton Hall, which has been held by 50 black students and an unknown number of community militants for the past three days. Brown later delivered a speech on the steps of the building as admirers cheered him on. He said that he backed the demands of the demonstrators and threatened violence from the community if the demands are not met. ""We are going to let Columbia know that if they don't deal with the black brothers here, they're going to have to deal with the black people of Harlem,"" Brown said. Mark Rudd, chairman of Columbia's chapter of Students for a Democratic Society, said at a press conference at 7:30 p.m. tonight that he would not settle for anything less than a complete amnesty for all participants in the demonstration. He also rejected a proposal for a tripartite commission of students, faculty, and administration to help resolve the conflict. The demand for amnesty has now become the focus of the demonstration. One of the other three demands--stopping construction on a gymnasium in Morningside Park--has been met at least in part. The other two--ending ties with the Institute for Defense Analyses and dropping punishments for an earlier demonstration--are less important and are close to resolution now. Vow to Stay The 300 students inside the five buildings--Hamilton, Low Library, Avery Hall, Fayerweather Hall, and the mathematics building--again vowed to stay inside until their demands are met. Although no official statement has yet been made on the progress of negotiations between the students and the administration, several reliable sources here indicate that Columbia offered to let all the demonstrators off with mere warnings. The students, however, insist on no punishment at all. The Columbia Spectator, the university's daily newspaper, reported yesterday that sources indicated that the work stoppage on the gymnasium, announced yesterday as ""temporary,"" will be permanent. Today was the first day that members of the community bordering on Columbia actively participated in the demonstration. In all, 400 teenage Negro youths assembled on the grassy quadrangle in the center of the Columbia campus. They chanted anti-war slogans, listened to the radio, and cheered on speakers. The $10-million Columbia gymnasium was planned for an area that many of these youths use as a playground. Brown emphasized that this fight was the community's too. He and Carmichael left after about an hour. They were scheduled to speak in Newark tonight. Two Factions The campus is severely split into two factions--those who are sympathetic with the demands of the demonstrators and those who want them expelled. The sympathetic faculty group, called the Ad Hoc Committee, vociferously booed Vice President David B. Truman last night when he announced that Columbia was ordering outside police onto the campus. Several distinguished faculty members associated with this group have threatened to resign unless the demands are met. The other faculty group, led by Warner Shilling, a government professor, has said that it will make no concessions to the demonstrators. One faculty member reported that Shilling said at a meeting last night, ""Either Rudd goes or I go."" Shilling is faculty leader of a group of several hundred conservative students, many of them campus athletes, who call themselves the Majority Coalition. A leader of the Coalition, Frank Dann, a member of the swimming team, claimed that the administration had promised him that SDS demonstration leaders would be expelled. Dann's group continually harassed the demonstrators today, but there were no incidents of violence this time. Last year conservative students and SDS members came to blows during a demonstration against Marine recruiters. Beat Twenty Dollars Still, tempers were high. One student complained that while the University was closed he was missing classes. ""That costs me twenty dollars a day,"" he said. ""And I'm going to beat that twenty dollars out of one of those SDS kids when I get my hands on him."" Last night, members of the Coalition came to the steps of Fayeweather and demanded a chance to ""get even"" with the demonstrators inside. ""Three years of the administration giving in to SDS is a long time to restrain ourselves,"" one said. Low Library, the huge Roman-style building where Columbia President Grayson Kirk has his offices, remained the focus of attention today. Professor Robert Fogelson announced that students would no longer have free access to the building. He explained that if the demonstrators left the building they would have their identification cards confiscated and would be unable to re-enter. Food and messages could be brought inside however. The first to leave was Gary Menaged, who said that his father had wanted to talk to him about the demonstration. Menaged, who had been inside the library for two days, said that he did not know he could not return. A student saw Menaged as he climbed down from one of the library windows and brought him over to a proctor, who took his identification card. Menaged, who appeared pale and tired, said that the demonstrators had adequate food. Girls had set up a kitchen, he said. He also said that the people inside feared a police charge last night. They had the doors and windows barricaded with filing cabinets, chairs, and tables. ""Everyone inside was really scared,"" he said. But the police did not get inside the building. Instead, they charged the faculty members who had surrounded Low on the outside to keep away assaults of conservative students. Twenty-five plainclothes police, billy clubs concealed at first under their trench coats, tried to break up the faculty for some unknown reason. In the melee that followed, one faculty member, Richard Greenman suffered a five-inch gash on the forehead and had to be hospitalized. An unidentified woman was also slightly injured. According to the New York Post, sources in Mayor John V. Lindsay's office said that the police moved toward the building at the request of Kirk, although Kirk did not intend the men to break up the faculty, but merely ""get into position."
